title,text,subject,date,reliable
"Trump foreign policies could hurt, help his business empire","LONDON (Reuters) - Any moves by Donald Trump to ban Muslims from entering the United States or bring back waterboarding to interrogate suspects could have repercussions for some of his sprawling foreign business interests — from his golf course in Scotland to luxury resorts in Indonesia. A review of press releases published on the Trump Organization website shows that 15 of 25 new acquisitions or joint ventures announced over the past five years were overseas. These include the purchase of golf courses in Ireland and Scotland and deals to license his name to developers and manufacturers in Dubai, Indonesia, India, Azerbaijan, Brazil, Mexico and Panama. The deals underscore the potential conflicts of interest Trump will face after he is sworn in as president on Jan. 20 and his vulnerability to criticism that he is open to foreign influence. Foreign governments could potentially seek to exploit Trump’s business interests to affect his decision making, or to punish him through his pocket book for decisions they object to. Trump’s transition team declined to comment for this story. In the 16 months to May, Trump earned up to $23 million from licensing his name to developers in emerging markets, according to a filing with the U.S. Office of Government Ethics. “The licensing deals are the best of all because there’s no risk,” Trump told Reuters in an interview in June. “I have 121 deals right now, going forward, right now, 121, all over the world, in China, in Indonesia,” he added. (Trump's foreign business interests: tmsnrt.rs/2gakiTQ) Trump has said he will hand control of his company to his children.  However, when he met with his Indian business partners last week it prompted a chorus of criticism that the wall between Trump and his company was still too porous. The Trump Organization has said a business structure will be set up that complies with “all applicable rules and regulations.” Trump has yet to commit to setting up a blind trust that would formally sever his ties with his business.  “I’m very confident he’s not breaking any laws,” Kellyanne Conway, a senior adviser to Trump, told reporters at Trump Tower in New York on Monday. Trump could face a backlash against his business interests in Middle Eastern and Asian markets if he follows through with his campaign promise to ban Muslims from entering the United States, and continues to be open to restoring waterboarding - a form of interrogation widely viewed as torture - or creating a national registry for Muslims, analysts said. “If the Muslim registry is introduced, he will have serious issues finding Muslim local partners,” said Professor Koen Pauwels, a marketing specialist at Ozyegin University, Istanbul. There would be a “backlash” if Trump substantially tightens visa restrictions on Muslim visitors, Pauwels added. In December 2015, Trump’s anti-Muslim comments cost him business in the Middle East when a major chain of department stores halted sales of his glitzy “Trump Home” line of lamps, mirrors and jewelry boxes in the region. Trump has long identified the Middle East as a major growth market, and his company is working with Dubai-based real estate giant DAMAC Properties to build two golf clubs - including one with a course designed by Tiger Woods - and a gated island community outside the city.  His daughter Ivanka said last year the organization was in talks on deals in Qatar and Saudi Arabia. Trump has a licensing deal with a developer for a Trump-branded retail complex in Istanbul. He also has signed deals in Indonesia, the world’s most populous Muslim country, to put his name on a redeveloped luxury golf resort in Java and a luxury cliff-top hotel and residential development in Bali. And it is not just in the Middle East that Trump could face repercussions for any foreign policy decisions. Trump’s $1.5 billion billion-pound golf and residential project north of Aberdeen in Scotland could also be affected, warned councilor Isobel Davidson, who sits on the panel responsible for approving planning applications for the project. If Trump proceeds with any anti-Muslim proposal, it could make it harder for him to advance his development, she said. “Councilors are not supposed to take the character of the applicant into consideration when we are making a planning decision but sometimes it’s quite hard not to,” she said. Analysts said they saw more potential upside for Trump’s business from his election than downside. Very simply, people would want to be associated with the personal brand of the U.S. president. “It will have a boost because he has become more famous that he was before,” said Professor Chiranjib Sen, Azim Premji University in India’s Bangalore. One test case could be China, which the Trump Organization has identified as a “top priority among high-potential emerging markets,” according to a 2013 press release. On the campaign trail, Trump threatened to label China a currency manipulator and impose import tariffs on Chinese imports.  Suisheng Zhao, a China expert at the University of Denver, said if Trump did impose tariffs and more robustly challenged China’s interests in the South China Sea, Beijing could tell Chinese businesses to abandon any talks or deals with the Trump Organization. Trump-branded property could also present a target for bombings or other kinds of attacks, said Professor Peter Neumann, of the International Centre for the Study of Radicalisation and Political Violence at King’s College London. “From a terrorist’s perspective, it’s a very attractive target,” he said. What Trump does not do could also affect his foreign business interests.  Mehmet Ugur, Professor of Economics and Institutions, at the University of Greenwich Business School, said that Trump’s businesses could benefit if he takes a softer line on countries accused of human rights violations.  Countries such as Turkey, China and Indonesia would “be more than happy to welcome Trump Organization,” he said.",politicsNews,"November 22, 2016",1
Philippine mobile phone trader 'collected funds' for Marawi attackers,"MANILA (Reuters) - Philippine security forces have arrested a mobile phone trader suspected of collecting funds to help finance pro-Islamic State militants who took over a southern city for five months, police said on Friday. Rasdi Malawani, 42, was paraded in front of the press a day after security forces raided his home in Manila s northern suburbs, where a rocket-propelled grenade and a pistol were seized, Manila police chief Oscar Albayalde said. Malawani was not allowed to speak to reporters and no defense lawyer was present. The military on Monday declared victory over the Maute group, which seized control in Marawi City on May 23, after killing the last 40 remaining militants. More than 1,100 people, including 165 soldiers, were killed in the conflict.  Malawani is the brother-in-law of Maddie Maute, one of the Maute brothers who planned and carried out the Marawi attacks, according to police. They said he had given about 300,000 pesos ($5,800) a month for four months to his sister, Lily. The funds were collected from dozens of tenants of Salaam Bazaar, a mobile phone, accessories and electronic market owned by Farhana Maute, the jailed family matriarch, in a shopping mall in Quezon City, police said. Malawani had been running the business for her.  He is facilitating terrorist financing,  Albayalde said.  He is based here in Manila and is not involved in the fighting. He is considered a supporter and sympathizer.  President Rodrigo Duterte, in a speech before an association of professionals late on Thursday, warned of possible retaliation from militants after the military s victory in Marawi.  Retaliation and vengeance are not far-fetched,  Duterte said.  May I just remind you to be vigilant and always be aware that extremism is the problem of the planet today.  Philippine military chief General Eduardo Ano said on Monday Islamist militants who attacked Marawi on May 23 had received some $1.5 million from Islamic State leader Abu Bakr al-Baghdadi in January. ($1 = 52 pesos)",worldnews,"October 27, 2017",1
Trump administration nearing completion of Cuba policy review: sources,"WASHINGTON (Reuters) - The Trump administration is nearing completion of a policy review to determine how far it goes in rolling back former President Barack Obama’s engagement with Cuba and could make an announcement next month, according to current and former U.S. officials and people familiar with the discussions. President Donald Trump’s advisers are crafting recommendations that could call for tightening some of the trade and travel rules that Obama eased in his rapprochement with Havana but which are expected to stop short of breaking diplomatic relations restored in 2015 after more than five decades of hostility, the sources said. The policy review, coordinated by the National Security Council, is expected pick up steam now that Trump has returned from his first foreign trip, one administration official said, speaking on condition of anonymity. The White House did not respond to a request for comment. Trump threatened in a tweet shortly after his election in November to “terminate” Obama’s approach unless Cuba made significant concessions, something its Communist leadership is unlikely to do. The White House said in February that Cuba policy was under comprehensive review and that human rights on the island would be a major part of any revised strategy. Obama implemented his Cuba normalization measures through executive actions that bypassed Congress, and Trump is believed to have the power to undo much of it with the stroke of a pen. But there are divisions within his administration over to what extent he should go, especially given that Obama’s opening to Washington’s former Cold War foe has created opportunities for American companies ranging from telecommunications to airlines. Some aides have argued that Trump, a former real estate magnate who won the presidency promising to unleash U.S. businesses and create jobs, would have a hard time defending any moves that close off the Cuban market. A group of 54 U.S. senators reintroduced legislation last Thursday to repeal all remaining restrictions on travel to Cuba, signaling support for U.S.-Cuba detente on Capitol Hill. But the Republican administration has been under heavy pressure from Cuban-American lawmakers such as U.S. Senator Marco Rubio and U.S. Representative Mario Diaz-Balart to take a much harder line than Trump’s Democratic predecessor. There is little support in the administration, however, for a full-scale reversal of Obama’s steps that began with a  breakthrough with Cuban President Raul Castro in 2014. Among the options under consideration are tightening restrictions on U.S. firms doing business with Cuban state or military enterprises and re-imposing stricter rules on  Americans traveling there, according to people familiar with the discussions. It remains unclear, however, which recommendation will make their way to Trump, though the sources said a list was likely to be ready for his consideration in coming days or weeks. “We’re getting closer,” an administration official said. An announcement of changes could come as soon as June, according to the official and people familiar with the matter. The Daily Caller newspaper reported on Sunday that Trump would announce policy changes in a June speech in Miami, citing sources from a group opposed to the broader U.S. economic embargo that remains in place against Cuba. But the timing could also depend on factors such as whether Trump fills key Latin America posts at the State Department and elsewhere that remain vacant, sources told Reuters. The White House considered making a Cuba announcement on May 20 to mark the 115th anniversary of Cuba’s independence, but that coincided with Trump’s overseas trip and the review also was not yet finished, the sources said.",politicsNews,"May 30, 2017",1
Poles dressed in black march in defense of women's rights,"WARSAW (Reuters) - Several thousand Poles dressed in black marched through city streets in Poland on Tuesday in defense of women s rights, on the first anniversary of mass protests against a planned near-total ban on abortion.  We go out because the fight continues,  organizers of the Black Tuesday protest said on social media.  Let them see us, let them hear us, let them know that we are not afraid.  The Warsaw city council said about four thousand people marched in the Polish capital. The protests took place as proponents of a ban on abortions are pushing a draft bill to exclude terminating a pregnancy if the baby is likely to be permanently handicapped.",worldnews,"October 3, 2017",1
Hillary Has BIG Lead Over Trump In Latest National Poll,"It appears Clinton s  post convention bump  has not ended quite yet. In a new national poll released from Quinnipiac, Hillary Clinton is trouncing Donald Trump by 10 points, which has been consistent with her post-convention spike in the polls.Not only is Clinton beating Trump by 10 points in this stage of the game, she has nabbed 51 percent of the vote, a milestone not reached in polling until now. With now a majority of the country supporting Clinton, Trump will have to work hard to overcome his self-inflicted controversies and multiple  shakeups  that have hardline conservatives anxious.The poll shows Clinton winning with the support of the Obama coalition:The Democratic nominee drew wide levels of support from women (60 percent to 36 percent), those between the ages of 18-34 (64 percent to 29 percent), and 35-49 (53 percent to 39 percent). Trump, meanwhile, holds a smaller advantage among men (48 percent to 42 percent) and a large lead over Clinton among whites who do not have a college degree (58 percent to 35 percent).Independent voters prefer Clinton slightly, 46 percent to 41 percent, while likely voters between the ages of 50-64 are split, with 46 percent behind Clinton and 47 percent backing Trump. Voters 65 and older supported Trump 49 percent to 45 percent.Clinton also holds a lead of 62 points among non-white voters, 77 percent to Trumps 15 percent. Looks like his African American outreach and immigration flip-flopping is going swimmingly.The poll, which was conducted on Aug. 18-24, surveying 1,498 likely voters, and with a margin of error of 2.5 percent, shows that nine of ten voters surveyed said they have made up their mind about who they were going to vote for.Even when factoring in third party candidates Gary Johnson and Jill Stein, Clinton still beats Trump by 5 points.The time for Trump to appeal to undecided, independent voters is quickly coming to a close, as early voting begins mid September.Clinton s RealClearPolitics average has her up by 5 points, and Nate Silver s FiveThirtyEight gives her an 84 percent chance of winning the election, so the poll conducted by Quinnipiac is not an outlier.Featured image via Jeff Swensen/Getty Images",News,"August 25, 2016",0
Lockheed Martin wins $450 million Pentagon contract: statement,"WASHINGTON (Reuters) - Lockheed Martin Corp has been awarded a $450 million modification to a previous contract linked to the development and delivery of F-35A aircraft to South Korea, the Pentagon said in a statement on Thursday.",politicsNews,"December 29, 2016",1
Patriots Fan Who Tracked Down Brady Jersey Surprised by Trump Friend and Team Owner [Video],"The New England Patriots owner Robert Kraft surprised a teen fan who did an awesome job retrieving Tom Brady s stolen Super Bowl 51 and 49 jerseys. President Trump s great friend gave the teen front row seats to the team s regular-season opener against the Kansas City Chiefs:Patriots owner Robert Kraft met Dylan Wagner (guy who solved the mystery of Tom Brady s missing Super Bowl jerseys) for 1st time @cbsboston pic.twitter.com/5yM65wsrQH  Nick Giovanni (@NickGNews) September 7, 2017Kraft met with Seattle native Dylan Wagner, 19, on Thursday morning to deliver the tickets, a signed Brady jersey, and a pair of Air Force 1s, which cost around $140, according to TMZ. And as if that wasn t enough, Wagner also gets to sit in seat No. 12, which happens to be Brady s number.Wagner helped to track down the culprit, Mauricio Ortega, by tipping off the FBI about the former Mexican tabloid director who absconded with Brady s jersey after the Patriots  Super Bowl victory over the Atlanta Falcons in February.Robert Kraft and President Trump are great friends. Mr. Kraft tells the story often of how POTUS called him every day the year after his wife died. Donald Trump is a good friend.Read more: Daily Mail",politics,"Sep 7, 2017",0
Clinton says Russian intelligence services hacked DNC,"WASHINGTON (Reuters) - U.S. Democratic presidential candidate Hillary Clinton said Russian intelligence services hacked into Democratic National Committee computers and she accused Republican contender Donald Trump of showing support for Russian President Vladimir Putin. “We know that Russian intelligence services hacked into the DNC and we know that they arranged for a lot of those emails to be released and we know that Donald Trump has shown a very troubling willingness to back up Putin, to support Putin,” Clinton said in an interview with “Fox News Sunday.” The United States has not publicly accused Russia of being behind the hack of Democratic Party computers. Cyber security experts and U.S. officials, however, said they believed Russia engineered the release of the emails to influence the Nov. 8 U.S. presidential election. Asked if she believed Putin wanted Trump to win the White House, Clinton said she was not going to jump to that conclusion. “But I think laying out the facts raises serious issues about Russian interference in our elections, in our democracy,” Clinton told Fox in the interview, taped Saturday. The United States would not tolerate that from any other country, especially one considered an adversary, she said. “For Trump to both encourage that and to praise Putin  despite what appears to be a deliberate effort to try to affect the election I think raises national security issues,” she said. The New York businessman has praised Putin, saying he was a stronger leader than U.S. President Barack Obama, a Democrat. Trump last week invited Russia to dig up tens of thousands of “missing” emails from Clinton’s time at the U.S. State Department. “Russia, if you’re listening, I hope you’re able to find the 30,000 emails that are missing,” Trump told reporters. The Republican presidential nominee for the Nov. 8 election later said he was being “sarcastic” in his comments, which raised concerns among intelligence experts and criticism that  Trump was urging a foreign government to spy on Americans.",politicsNews,"July 31, 2016",1
East Timor President says to swear in Mari Alkatiri as PM,"DILI (Reuters) - East Timor is set to swear in Mari Alkatiri for a second stint as prime minister, the country s president said on Thursday, with Asia s youngest democracy facing stiff challenges to boost a flagging economy heavily reliant on oil and gas.  Alkatiri, the secretary general of the Fretilin party, was East Timor s first prime minister after independence from Indonesia in 2002. He stood down in 2006 after a wave of unrest sparked by the sacking of 600 soldiers.  Today I announce to all the people that the president of the republic ... has nominated Dr. Mari Alkatiri to become the prime minister,  President Francisco  Lu Olo  Guterres told a news conference. Guterres called for people to remain calm and said Alkatiri would form a minority government. He expected Alkatiri s  swearing-in to be held either later on Thursday or on Friday.  The most important thing is the politicians need to think about how to maintain government stability in the future and ensure peace,  he said. Fretilin, or the Revolutionary Front for an Independent East Timor, won the most votes in July s election but failed to get an outright majority. It intends to form a coalition with the small Democratic Party. It had been in a de facto coalition since 2015 with the National Congress for Timorese Reconstruction, a party founded by former independence fighter Xanana Gusmao.  Alkatiri, who is a Muslim in the predominantly Roman Catholic nation, spent several decades living in exile in Mozambique during East Timor s struggle for independence. The next prime minister will face pressure to lift flagging oil production in the tiny nation of 1.3 million people, where unemployment and poverty remain high.  Dwindling output from existing oil and gas fields, compounded by the slumping prices of the commodities, have hit the government s budget and crimped its ambition to develop manufacturing as an engine for economic growth.  Australia and East Timor reached a breakthrough agreement earlier this month on a maritime border, ending a decade-old row that has stalled a $40 billion offshore gas project. The long-running dispute has led the owners of the Greater Sunrise fields - Woodside Petroleum, ConocoPhillips, Royal Dutch Shell and Japan s Osaka Gas - to shelve the project.",worldnews,"September 14, 2017",1
