title,text,subject,date,reliable
"Brooking no dissent, Marine Le Pen takes grip on French far-right","PARIS (Reuters) - Marine Le Pen has acted to reassert her authority over France s far-right National Front with the forced departure of her deputy, but still faces a struggle to persuade the party base that she has what it takes to win an election. The exit of Florian Philippot, who quit last week over policy differences with Le Pen since her resounding defeat by Emmanuel Macron in May s presidential election, shows the 49-year-old daughter of party founder Jean-Marie Le Pen can be tough when required. But her past flip-flops over policy, and less-than-assured performance in a TV debate against Macron before the presidential run-off, have raised doubts about whether she can take the National Front from being a major factor in French politics to a party that can hold power.  Le Pen s image has seriously deteriorated,  said Frederic Dabi of polling group Ifop, who carried out a survey on Sept 7-8 that shows only 27 percent of voters think she has the stature of a president, down seven percentage points since March.  Her problem in terms of image is not authority, she is seen as being very firm, but it is competence, stature,  he said.  Can she be seen as an alternative to Emmanuel Macron? It s not looking that way.  Le Pen took a lower-than-expected 33.9 percent of votes in the presidential run-off, while her party won only 8.75 percent in the second round of parliamentary elections that followed. However, support for the European far-right may not have peaked despite setbacks in the Netherlands and Austria too. At the weekend, the anti-immigrant Alternative for Germany scored 12.6 percent in federal elections, becoming the first far-right party to enter the Bundestag in more than half a century   an outcome Le Pen praised.[nL8N1M6092] [nL5N1M50PJ] A lawyer by training, Le Pen took over the party in 2011 and quickly managed to build a broader following. She succeeded in detoxifying its image, distancing it from the anti-Semitic labels it attracted under her father, and adopting pro-welfare economic policies that appealed to a wider range of voters. Out went her father, the one-eyed former paratrooper who reveled in provocative comments, expelled from the party in 2015. In came the daughter s softer image, with talk of lowering the retirement age and protecting workers. She went on TV to talk about her love of gardening. A lot of that image adjustment was down to Philippot, a graduate of France s elite ENA administrative school who joined the party in 2011 and quickly rose to the top, an architect of Le Pen s 2012 and 2017 campaigns. But having broken with her father and now with Philippot, Le Pen must now show that she can get the policy mix right before another possible presidential bid in 2022.  The dispute with Philippot came to a head over the party s anti-euro stance. For her supporters, Le Pen s willingness to sacrifice her closest aide when he refused to do what he was told underscores her leadership credentials.  It shows that she gives priority to what s good for the party above personal considerations,  Gaetan Dussausaye, the  head of the party s youth group, told Reuters.   She knows what she wants, she s got strong beliefs and she ll do whatever is necessary to defend them,  said Dussausaye, who is a member of the National Front s top political committee.  But others worry about her flashes of aggression and lack of preparedness in the presidential debate, followed by the elections underperformance. They believe this means she has work to do to persuade the grassroots   and beyond them, a big enough number of voters   that she s a winner. A survey by Odoxa pollsters, carried out on Sept 6-7, showed that the biggest danger for Le Pen may come from within   from inside the family as much as the party.  This showed Marion Marechal-Le Pen, Marine s niece, who temporarily stepped away from politics, is the only top official seen as an asset by a majority of party members surveyed. More than half saw Marine Le Pen as a liability. Jerome Riviere, a former conservative lawmaker who joined Le Pen s campaign team, praised her openness to adjustments, including softening her anti-euro stance.  A good party chief needs to be representative of what grassroots activists want,  he said. But Le Pen s handling of the break with Philippot led others to conclude that she no longer knows where she stands.  There is a rise in influence of people who advise her in a way that is not true to her beliefs or good for the party,  Alain Avello, a regional councillor, told Reuters.  Avello, who once described himself a  Marine-ite , is one of several National Front members to have quit the party after Philippot s departure.     A crucial question will be how much Le Pen now allows the party s policies to evolve.  Philippot had long advocated a tough anti-euro and pro-welfare policy, which Le Pen had backed. But others want the party to re-focus on its anti-immigrant, economically liberal roots. It is expected to decide a new strategy and policies at a congress in March. In a letter to National Front members the day Philippot quit, Le Pen said the debate on overhauling the party would continue until the congress. She will tour France to meet supporters, who will be asked in a questionnaire how they want the party to change.   It is important to me that you, National Front members, be the ones to decide,  Le Pen said.",worldnews,"September 25, 2017",1
UPDATE: COMEY’S LEAKER Goes Into Hiding [Video],"A Columbia University professor from Brooklyn went into hiding Thursday after pal James Comey revealed during his Senate testimony that the man leaked memos detailing the former FBI chief s conversations with President Trump to the press.But Richman had vanished from his Henry Street digs by midday, and family members, friends and neighbors wouldn t answer doors or phone calls to shed any more light.A doorman eventually turned security guard to stop reporters entering the building.Richman s wife, Alexandra Bowie, is a former president of the influential neighborhood civic group the Brooklyn Heights Association. Its director, Peter Bray, declined to speak about the man who had suddenly usurped Lena Dunham as the nabe s most famous inhabitant.Comey said in his testimony that he decided to give the content of his Trump memo to his good friend to leak to the press after President Trump tweeted out about possible  takes  of their conversations. Comey also said of leaking the memo,  I thought it might prompt the appointment of a special counsel.  Via: NYPWho knew the FBI Director was a leaker! This is too much! Our intel community has become so politicized that it prohibits them from following the law or even focusing on gutting to the truth! During testimony today, Susan Collins asked if Comey ever shared memos from President Trump:COMEY S RESPONSE WAS A SHOCKER. HE SAID HE FELT HE NEEDED TO GET THAT OUT INTO THE PUBLIC SQUARE SO HE ASKED A FRIEND TO SHARE THE MEMO WITH A REPORTER:The person that Comey gave the memos to is a former classmate from Columbia Law School. He is considered to be a and adviser to Comey. Daniel Richman is in the video below and is a rather interesting guy. The video is dated but is meant to give you an idea of the character of this  friend  and  adviser  to the former FBI Director.Comey stated:James Comey leaked details of his conversation with @POTUS to  friend and confidant  Daniel Richman.Does this man look sane to you? pic.twitter.com/06Q7cfNRLI  Josh Caplan (@joshdcaplan) June 8, 2017 Does this man look sane to you? pic.twitter.com/06Q7cfNRLI  Josh Caplan (@joshdcaplan) June 8, 2017",Government News,"Jun 8, 2017",0
Democrats seek disclosure after Russia-backed political ads,"(Reuters) - Democratic U.S. lawmakers on Wednesday urged the Federal Election Commission to require transparency for social media advertising after Russians bought U.S. political ads on Facebook Inc (FB.O) in an alleged attempt to influence the 2016 elections. Pressure is mounting on regulators and Silicon Valley companies to open up the opaque world of online political ads and to prevent governments from using them to sway elections or attempt other meddling.  “Social media platforms offer the ability to target millions of users based upon a wealth of highly detailed information,” the lawmakers wrote in a letter to the election commission.  “As we have seen, the low cost of reaching these users equips hostile foreign actors with a powerful new tool for disruption of our democratic process.”  Some 20 Democrats from the Senate and House of Representatives signed the letter.  Facebook, the world’s largest social network, said this month that an operation likely based in Russia spent $100,000 on thousands of Facebook ads promoting divisive messages before and after last year’s U.S. presidential election.  Russia has denied meddling in the U.S. election, in which Republican Donald Trump defeated Democrat Hillary Clinton. U.S. congressional committees and special counsel Robert Mueller are investigating the allegations.     The Federal Election Commission last week sought public comment on possible regulatory changes, and the commission is considering holding a public hearing, with Facebook and other tech companies as invited witnesses.  Facebook has said it is working with U.S. authorities who are investigating alleged Russian meddling and also taking steps, such as removing fake accounts, to prevent manipulation of its platform.",politicsNews,"September 20, 2017",1
NOT KIDDING: Students Are Given Counseling After Seeing A “Symbol Of Oppression” On Student’s Laptop,"When did white students become throw away citizens on campuses?  White privilege has turned to  white shame  and outright psychological abuse at the hands of Black Lives Matter terrorists and pathetic excuses for educators University students in Massachusetts who were upset by an image of a Confederate flag sticker on another student s laptop were offered counseling services at Framingham State University.The offer came after the university s  chief diversity and inclusion officer,  Sean Huddleston, described the display of the small Confederate flag sticker as a  bias incident. According to Metrowest Daily News, students filed two  bias reports  within the past month as a result of a student displaying the flag in some way. The most recent bias incident   reported on November 19   was a report of a student having seen a Confederate flag sticker on another student s laptop.In an email to students, Huddleston did not declare a ban on displaying the flag, but claimed that it upsets some students.MRCTV obtained the email in which Huddleston wrote:A student reported a bias incident today, in which the image of the Confederate flag was displayed on a laptop. Many of you may be aware that last month we received a Bias Incident involving two other students for a similar issue. Although related in nature, the two incidents involve separate parties.The FSU Bias Protocol and Response Team has been made aware of the incident, and will meet to determine any measures that may be needed to respond to the incident. Our primary goal continues to be to expeditiously address and resolve incidents of bias that impede our progress toward a welcoming and inclusive campus community. Many see the Confederate flag as an inflammatory symbol of oppression and constant reminder of a dark period in the history of the United States in which slavery was a legal,  Huddleston continued, while  Others may simply view this flag as a symbol of shared southern heritage and in memory of the Civil War. Huddleston said the flag and other symbols  are not condoned by Framingham State University, as they violate the core values of our institution and not considered consistent with our desire to maintain a safe, respectful and welcoming campus community for all. He further described  bias incidents  as  situations that may not rise to the level of a criminal act, but still clearly communicate offensive or derogatory behaviors. Observing that students on campus in general may have suffered a traumatic reaction from seeing an image of the Confederate flag, Huddleston continued,  We recognize that bias incidents are upsetting for the entire campus community, but especially for the target(s) and witness(es) of these incidents. It is strongly suggested that anyone impacted by a bias incident find someone to speak with,  he wrote.According to FSU campus newspaper The Gatepost, social-media displayed a mixed reaction to Huddleston s email:On the popular anonymous social media app Yik Yak, one student said the Confederate flag controversy was  legitimately embarrassing  and  someone is getting in trouble for such stupid bullshit. Another student disagreed and compared the Confederate flag to the swastika. Adding,  That s the issue. In case you were somehow still confused in 2015. One anonymous student posted,  Carry a copy of the constitution tomorrow, see how fast the PC police emails fly. Via: Breitbart News",politics,"Nov 25, 2015",0
Trump Gets DESTROYED On Twitter For His Latest Tweet About Putin,"Donald Trump has made it clear that he has a very large place in his heart for Vladimir Putin, so big in fact, that he s taken his side against fellow Americans.Earlier today, Trump tweeted a response to a statement from Putin:Vladimir Putin said today about Hillary and Dems: ""In my opinion, it is humiliating. One must be able to lose with dignity."" So true!  Donald J. Trump (@realDonaldTrump) December 24, 2016Well, first off, Hillary won the popular vote, and Trump is in constant denial of that. Also, if the situation were reversed Trump would have thrown a giant temper-tantrum in response. Not to mention the fact he s taking the side of a foreign country against his fellow American people. Of course, how could he be against the man who helped him win the election? Donald Trump has no room to say what s dignified and what s not, in fact, he probably doesn t know what the word even means. Either way, Trump is getting plenty of comments in response to this tweet, and their completely justified.Our next President parroted an attack against his own citizens by a foreign adversary who launched a cyberattacks against the US. https://t.co/RbWDMJ20Ug  Jon Favreau (@jonfavs) December 24, 2016The sad part is, Jon has an excellent point. Apparently, Donald Trump would rather please Vladimir than the 65 million Americans who voted for Clinton.The Rude Pundit also made a great remark in response to the president-elect s tweet:Seriously, arrest this fraud. Let's have the fight that would cause. What would do more damage? That or his presidency? https://t.co/q9JrAGeJtd  The Rude Pundit (@rudepundit) December 24, 2016It s probably safe to say Trump s presidency would do more damage, but sadly we won t know for sure until it s too late.Michael McFaul also responded to Trump s nearly treasonous tweet:So now the President-elect and an autocrat in the Kremlin team up to trash an American. Unprecedented. Will Republicans speak up? https://t.co/Vef1g5tiFK  Michael McFaul (@McFaul) December 24, 2016Michael made a small mistake in this tweet though, it wasn t an American, it was 65 million Americans.The tweets don t stop here though, they continue on, calling Trump on all the irony of his tweet.The President-elect is tweeting lessons in how to ""lose with dignity"" from an authoritarian who murders his political opponents.For real. https://t.co/1PG5T1wn2w  Mo Elleithee (@MoElleithee) December 24, 2016The president elect taking the side of an authoritarian dictator against half the country https://t.co/TUpmNbaJNp  Michael Cohen (@speechboy71) December 24, 2016Donald Trump continues to embarrass himself on Twitter and it s awesome because we get to laugh and make fun of him all the time. Well, sort of. The major downside about this is Trump is serious about what he says, and everything he says is garbage, but that s what we have to deal with for the next four years.He's quoting Putin. This is going to be a long four years. https://t.co/iKzEP4fTlW  deray mckesson (@deray) December 24, 2016Featured image via Joe Raedle/Getty Images",News,"December 27, 2016",0
No Class Michelle Obama Takes Several Swipes At Trump During Tech Speech And Veiled Swipe At Clintons: ‘People that won’t go away’ [Video],"No class and no decorum! The always bitter Michelle Obama told a Salt Lake City audience today that  we are looking at two different administrations. THIS IS LAUGHABLE:One, she said, was built on hope. The other is being led with fear.WE RE IN THIS MESS BECAUSE OBAMA DIDN T PUT AMERICA FIRST BUT MICHELLE SAYS:  It isn t just us first,  she said, a reference to Trump s  America First  agenda.  We live in a big country and a big world.   You can t just want to help someone in a hurricane and not make sure they can go to the doctor when they re sick. HUH?Her remarks, part of an hourlong moderated conversation, came on the last of a three-day tech conference hosted by Pluralsight, a Utah-based company.She claimed  things are tough right now  and suggested  we re being tested,  Obama professed that she  continues to be hopeful  that the political climate will improve. A BUNCH OF WHITE GUYS . WOMEN AND PEOPLE OF COLOR Obama urged computing companies to invest in and hire more women and people of color  Changing that composition, Obama said, will take encouraging girls at a young age to study science and math. It will mean bridging  the technology gap  that persists in low-income districts. It requires revisions to the public-school system. And it warrants forming hiring committees with more women and people of color.  You can t just say you want to fix the problems, you have to mean it,  Obama said.  If a bunch of white guys are sitting around the table trying to get more women involved, they re not going to come up with the answer.  For Utah s Silicon Slopes and elsewhere, she added, a behavioral change in the office environment at IT corporations will need to accompany that shift. You can t hire women and then they come in and they re working for chimps. No offense   you guys aren t all chimps,  Obama said to laughs from the crowd.  I call my husband a chimp sometimes, especially when he s watching the Sports Center. I m like  Come on. Look at you. You re an animal. CLINTON JAB? What Barack and I don t want to be is the people that won t go away,  she said, finishing the event with a standing ovation.  We want to help the next generation come up and take our seats. Read more: sltrb",left-news,"Sep 22, 2017",0
"Michael Flynn Begs For Donations On Twitter, Gets Wrecked By The Internet","Remember that time Michael Flynn led  lock her up  chants at a rally for Donald Trump, and also said that he  would be in jail  if he had done  a tenth  of what Hillary Clinton did? Well, that was last year. It s 2017 and the disgraced former Trump administration national security adviser is begging for donations to help with expenses to defray costs connected to the investigations into Russian election meddling. The various investigations arising out of the 2016 presidential election have placed a tremendous financial burden on our brother Mike and his family. The enormous expense of attorneys  fees and other related expenses far exceed their ability to pay,  Flynn s siblings, Joe Flynn and Barbara Redgate, said in a statement, according to CNN. To help ensure that he can defend himself, we have set up a legal defense fund, and we are asking Mike s supporters, veterans and all people of goodwill to contribute whatever amount they can to this fund.,  the statement continued.On Twitter, Flynn wrote,  Lori and I are very grateful to my brother Joe and sister Barbara for creating a fund to help pay my legal defense costs,  and added,  We deeply appreciate the support of family and friends across this nation who have touched our lives. Flynn included a link to donate so that he will not be locked up. Isn t karma a wonderful thing?We deeply appreciate the support of family and friends across this nation who have touched our lives. https://t.co/O08co3DRpn 2/2  General Flynn (@GenFlynn) September 18, 2017Twitter users are drinking Flynn s tears.#LOCKHIMUP  Joe H-man?? ? ? ?? (@HallmanComposer) September 18, 2017 pic.twitter.com/NHtRJektAa  Parker Molloy (@ParkerMolloy) September 18, 2017Do you accept rubles?  TJ (@TJishsh) September 18, 2017You mean you already spent all the money you got for selling out your country???  Bente Klinge (@BenteKlinge) September 18, 2017You're a traitor.  Grant Stern (@grantstern) September 18, 2017 pic.twitter.com/RuIhRiYexe  Rule of Law (@BaconJoel) September 18, 2017have fun in prison  Lee Perry (@likeleeperry) September 18, 2017Nice to know you'll have the support of family on visiting days.  StuckinIL (@mjamgb22) September 18, 2017I wish I could SPIT through twitter, you disgust me. ????? pic.twitter.com/ppe3fynMaH  cold war vet (@katkel_ga) September 18, 2017You could have saved the trouble of having to set up a defense fund by not being a traitor.  kat kl (@madkatkl) September 18, 2017Espionage is a tough charge to defend against eh Mike?  Pinche-GOP Meltdown (@Pinche_Pi) September 18, 2017Wait, this was the guy yelling ""lock her up""Karmas attacked to a blowtorch  Thirtysixmiles (@thirtysixmiles) September 18, 2017 pic.twitter.com/vXZbuZx2dW  SeriouslyUS? (@USseriously) September 18, 2017Maybe you should have saved some of that foreign money you lied about receiving  GatorOs (@GatorOs) September 18, 2017There are some Trump supporters on Twitter who are heralding Flynn as a  hero  who has been undermined by the  Deep State . We encourage those conservatives to donate every penny they have stashed away to help this traitorous arsehole while Special Counsel Robert Mueller buries him. Meanwhile, our donations can go to candidates who will help us to drain Trump s murky swamp which strangely seems to have a Russia accent now, thankyouverymuch.Photo by Andrew Harrer-Pool/Getty Images.",News,"September 18, 2017",0
"After Trump disclosures, UK's May says will continue to share intel with U.S.","LONDON (Reuters) - British Prime Minister Theresa May said on Wednesday the government has confidence in its relationship with the United States, and will continue to share intelligence with Britain’s most important defense and security ally. President Donald Trump has defended his decision to discuss intelligence with the Russians during a White House meeting last week, saying he had an “absolute right” to share “facts pertaining to terrorism and airline flight safety”.  “Decisions about what President Trump discusses with anybody that he has in the White House is a matter for President Trump,” May told a news conference when asked whether Trump’s disclosure had made her reluctant to share intelligence with him. “We continue to work with the United States and continue to share intelligence with the United States as we do with others around the world because we are all working together to deal with the threats that we face.” The question came during a press briefing ahead of Britain’s June 8 election, which polls show May is on course to win, and in which national security is seen as one of her political strengths. May is a former interior minister who spent six years in charge of the domestic security brief. May was the first foreign leader to meet with Trump following his inauguration, and has repeatedly reaffirmed the special relationship between the two countries: a military and economic alliance dating back to 19th century. Trump has endured a week of tumult at the White House after he fired the head of the FBI and then discussed sensitive national security information about Islamic State with Russian Foreign Minister Sergei Lavrov. But, May said she remained confident in the special relationship, highlighting the need to cooperate with the United States and other allies to counter the security threats posed by Islamic State and al-Qaeda. “We continue to work together and we have confidence in that relationship between us and the United States that it helps to keep us all safer,” she said.",politicsNews,"May 17, 2017",1
