title,text,subject,date,reliable
Fewer than a third of Americans back Trump tax plan: Reuters/Ipsos poll,"WASHINGTON (Reuters) - Fewer than a third of Americans support Donald Trump’s tax-cut plan, according to a Reuters/Ipsos poll released on Tuesday, as the U.S. president went to Capitol Hill looking for Republican backing for his proposal to slash tax rates for individuals and companies.  As the 2018 midterm congressional election campaigns grow nearer, the poll found that more than two-thirds of registered voters said reducing the U.S. federal budget deficit is more important than cutting taxes for the wealthy or for corporations. Trump’s plan would balloon the deficit and add to the $20 trillion national debt, according to critics and independent analysts, but Republicans say the tax cuts proposed in the plan would be offset by economic growth that would generate new tax revenue. Among Republicans surveyed, 63 percent said deficit reduction should take priority over tax cuts for corporations, while 75 percent said deficit reduction should take priority over tax cuts for the wealthy. Democrats oppose Trump’s plan, unveiled on Sept. 27, and say it is unfair to the poor and the working class.  The plan is still only a nine-page “framework.” It was drafted in secret by Trump administration and congressional leaders. Formal legislation is in development. Congressional leaders and Trump are trying to lock in support for the plan from rank-and-file Republicans, who were uninvolved in the framework drafting process. Trump, who has yet to score a major legislative win since taking office in January, wants his plan to become law before year’s end, a timeframe that some policy analysts doubt is realistic. More than half of the adults surveyed in the poll agreed that “cutting taxes for the poor is more important than reducing the federal deficit,” with 68 percent of Democrats and 47 percent of Republicans in accord with that statement, the poll showed. The Oct. 20-23 poll found that only 15 percent of registered voters said Republicans in Congress should prioritize tax reform over other issues. About a quarter of those polled, including 23 percent of Democrats and 30 percent of Republicans, agreed that Congress should continue working on a healthcare bill. Of those adults who said they had heard of the “tax reform plan recently proposed by congressional Republicans,” just 28 percent said they support it, while 41 percent said they oppose it and another 31 percent said they do not know.  The poll found opinions on Trump’s plan were sharply divided along party lines, with 56 percent of Republicans and just 9 percent of Democrats supporting it. Of those who had heard of the plan, 14 percent said it would cut their taxes, while 30 percent said it would increase their taxes. Another 35 percent said their taxes would not change and 20 percent said they did not know how it would impact them. The Reuters/Ipsos poll was conducted online in English in all 50 states. It gathered responses from 1,862 people, including 1,079 people who said they were aware of the Republican tax plan. It has a credibility interval, a measure of accuracy, of 3 percentage points.",politicsNews,"October 24, 2017",1
Ukraine police fail to find Saakashvili in protest camp raid,"KIEV (Reuters) - Dozens of Ukrainian police in riot gear raided a protest camp outside parliament on Wednesday in a failed attempt to detain former Georgian president Mikheil Saakashvili, who was freed from custody by supporters a day earlier. Saakashvili later said police had searched the wrong tent at the camp, continuing a surreal hide-and-seek game between him and Ukrainian law enforcement ever since he barged across the border from Poland three months ago.  Saakashvili was granted Ukrainian citizenship and invited by President Petro Poroshenko to become governor of the Odessa region after the  Maidan  protests ousted a pro-Russian president in early 2014, but the two later fell out.  The saga threatens to embarrass the pro-Western leadership in Kiev, although Saakashvili s party, which is now seeking to unseat Poroshenko at the ballot box, does not have nationwide support, opinion polls show.     Protesters defended the camp, which was set up in September, leading to clashes in which four policemen and an unknown number of civilians were wounded, Kiev police said in a statement. General Prosecutor Yuriy Lutsenko later acknowledged that the operation could have been carried out more effectively, but said police had acted in accordance with the law.  Saakashvili will be detained and the best thing he could do, if he were a man, if he really loved Ukraine even a little, would be to come today to Volodymyrska Street (security service headquarters) to testify to investigators,  he told parliament.   The situation near parliament was calm at around 1230 GMT, although an increased number of armored police stood guard around the building, according to a Reuters witness. Lutsenko has vowed to make all efforts to regain custody of Saakashvili, who was freed by his supporters from a police van in a chaotic scene on Tuesday after being detained on suspicion of assisting a criminal organization.  In a televised briefing on Wednesday, Saakashvili   supporters see him as a fearless crusader against corruption   said he would not present himself to law enforcement officials, as requested by the General Prosecutor s office.  I am prepared to meet an investigator of the prosecutor in the tent city,  he said. His detention was the latest twist in a prolonged feud between the Ukrainian authorities and Saakashvili, who has turned on his one-time patron Poroshenko, accusing him of corruption and calling for his removal from office. Poroshenko s office said prosecutors have evidence to back up the claims against Saakashvili, whom they accuse of receiving financing from criminals linked to former president Viktor Yanukovich who planned to overthrow the current government.  Saakashvili was stripped of his Ukrainian citizenship by Poroshenko in July while abroad and is now stateless. The 49-year-old is facing the threat of possible extradition to Georgia, where he is wanted on criminal charges he says were trumped up for political reasons.",worldnews,"December 6, 2017",1
U.S. official backs Trump version on Comey firing timing,"WASHINGTON (Reuters) - U.S. President Donald Trump decided to fire FBI chief James Comey before Deputy Attorney General Rod Rosenstein wrote a memo outlining his own concerns, Rosenstein said in a statement on Friday that lent credence to Trump’s version of events. When it was announced this month that Comey had been fired, White House officials initially pointed to the Rosenstein memo as a reason for firing the FBI director, who was overseeing an investigation into any collusion between Russia and the Trump campaign during the 2016 U.S. presidential election. Trump said in a subsequent interview with NBC News that he had been planning to fire Comey before he received the Rosenstein memo. In a statement on Friday seen by Reuters, Rosenstein writes: “I informed the senior attorney that the president was going to remove Director Comey, (and) that I was writing a memorandum to the attorney general summarizing my own concerns.”  The statement, first reported by NBC News, Rosenstein goes on to outline some of his concerns with Comey’s job performance. But toward the end of the 2 1/2-page document, Rosenstein writes: “My memorandum is not a statement of reasons to justify a for-cause termination (firing).” After Rosenstein briefed members of the House of Representatives on Friday, Congressman Darrell Issa was asked by reporters if Rosenstein indicated whether anyone had asked or encouraged him to write the memo about Comey. “I don’t believe he ... indicated anyone directed him but in fact he wrote the memo,” said Issa, who, like Trump, is a Republican. Some Democrats left the briefing saying they were not satisfied with the information Rosenstein provided. “There was a presentation followed by Q and A and not a whole lot of A,” said Democratic Representative Charles Crist. Representative Brad Sherman, also a Democrat, said Rosenstein “avoided at least 10 times” Democrats’ queries into whether the Justice Department official was pressured to write a memo critical of Comey. Sherman, a member of the House Foreign Affairs Committee, told reporters that while Washington investigations are exploring whether there was collusion between Trump campaign officials and the Kremlin and a possible cover-up, “neither of them have been proven.”",politicsNews,"May 19, 2017",1
Moscow hopes Syrian opposition will attend Russia-backed congress: Ifax,"MOSCOW (Reuters) - Russia hopes that all Syrian opposition groups will attend a Moscow-backed Syrian congress in southern Russia on Nov. 18 despite some objections, Russian Deputy Foreign Minister Mikhail Bogdanov said on Thursday, the Interfax news agency reported. The event, called the Syrian Congress on National Dialogue, was first mentioned by President Vladimir Putin last month who said he believed that militants in Syria would soon be defeated. It is due to be held in the Black Sea resort of Sochi.  But while Damascus has backed the Russian plan, some opposition groups have rejected the idea, calling it an attempt to rehabilitate President Bashar al-Assad s government. They have said they will stick to U.N.-brokered Geneva peace talks. Asked if Moscow still hoped to see opposition groups like the High Negotiations Committee, which has refused to come, attending, Interfax cited Bogdanov as saying:  We hope that everyone who believes that the fate of the country, its unity, its territorial integrity and its sovereignty are important will participate.",worldnews,"November 2, 2017",1
"Russians targeted 21 election systems, U.S. official says","WASHINGTON (Reuters) - Russian hackers targeted 21 U.S. state election systems in the 2016 presidential race and a small number were breached but  there was no evidence any votes were manipulated, a Homeland Security Department official told Congress on Wednesday. Jeanette Manfra, the department’s acting deputy undersecretary of cyber security, testified before the Senate Intelligence Committee. U.S. intelligence agencies have concluded the Kremlin orchestrated a wide-ranging influence operation that included email hacking and online propaganda to discredit Democratic presidential candidate Hillary Clinton and help Donald Trump, a Republican, win the White House in November. The Russia issue has cast a shadow over Trump’s first five months in office. The extent of interference by Russian hackers, and whether they or others could interfere in future elections, has been the source of speculation and media reports for months. Russia has repeatedly denied responsibility for any cyber attacks during the election. Trump has variously said Russia may or may not have been responsible for hacking but has dismissed allegations his associates colluded with Moscow as “fake news.” Manfra and other officials testifying on Wednesday said U.S. elections are resilient to hacking in part because they are decentralized and largely operated on the state and local level. Senator Angus King, an independent from Maine who caucuses with the Democrats, voiced skepticism, saying only a small number of votes in key battleground states would need to be altered to tip the scales in an election. “A sophisticated actor could hack an election simply by focusing on certain counties,” King said. “I don’t think it works just to say it’s a big system and diversity will protect us.” Mark Warner, the top Democrat on the Senate panel, expressed frustration at Manfra’s refusal to identify which states had been targeted. Arizona and Illinois last year confirmed that hackers had targeted their voter registration systems. Samuel Liles, another senior DHS cyber official, likened states targeted or scanned to a thief walking by homes to scout for weaknesses, and breaches to breaking through a front door. Special Counsel Robert Mueller, a former FBI director, met on Wednesday with senior Senate Judiciary Committee members to ensure there was no conflict between his investigation of potential collusion between Russia and the Trump campaign and the panel’s probe of what led to Trump firing Federal Bureau of Investigation Director James Comey. Trump acknowledged on Friday he was under investigation in the probe of alleged Russian meddling in the 2016 race and possible collusion by his campaign, and seemed to assail the Justice Department official overseeing the inquiry. Mueller was examining whether Trump or others sought to obstruct the probe, a person familiar with the inquiry told Reuters. Jeh Johnson, who led the Homeland Security Department until the end of the Obama administration, told the U.S. House of Representatives Intelligence Committee his department had issued warnings about hacking into voter registration databases. Asked why the Obama administration did not do more to warn the public, Johnson said: “We were very concerned that we would not be perceived as taking sides in the election, injecting ourselves into a very heated campaign.” He told the House committee, which is investigating alleged Russian meddling in the election, that the notices did not get the attention he would have liked, blaming the emergence of a 2005 videotape - in which Trump brags about sexual conquests - for distracting the American public.",politicsNews,"June 21, 2017",1
‘MORNING JOE’ HOSTS Hail John Conyers as ‘Icon’…Who ‘Shows Up In His Pajamas’ [Video],"Morning Joe  hosts Mika Brzezinski and Joe Scarborough agreed on Monday with Nancy Pelosi s defense of scandal-ridden Rep. John Conyers.  Look I think it s really important that the words  due process  have come up in this conversation, not that it s possible in every situation, but in this situation  Every situation that we ve covered in the past two months is different,  Brzezinski said referring to numerous accusations of sexual misconduct that have been levied against celebrities and politicians. They all have different dynamics to them, they all have different levels of nasty to them or bad to them. And they all need to be treated differently. This one breaks my heart, it really does,  Brzezinski said.In a report released last week, Conyers, 88-years-old and the longest currently serving congressman, was accused of settling a previous harassment claim, and further accused by other former staffers of misconduct. He subsequently stepped down as the ranking member on the House Judiciary Committee. The congressman denies the allegations. Michigan Congressman John Conyers has been in the spotlight recently for being a repeat sexual harasser to women he works with. He even showed up for a meeting in his underwear! Yikes!Nancy Pelosi defended Conyers on  Meet the Press  when she called him an  icon She went on to say that he deserves  due process . That s pretty ironic when you think of how the left wants to lock up any Republican right away if they re accused of wrongdoing. Conyers gets a pass because he s an  icon ? This is just more insanity from Pelosi who needs to retire with Conyers..@NancyPelosi: Accused Congressman Conyers is an ""icon"" in our country. #MTP pic.twitter.com/4QlKKJTIJP  Meet the Press (@MeetThePress) November 26, 2017 SHOWED UP TO A MEETING IN HIS UNDERWEAR The Detroit Free Press reported:A lawyer who formerly worked for U.S. Rep. John Conyers, D-Detroit, and later ran an ethics watchdog group in the nation s capital confirmed for the Free Press on Thursday that Conyers verbally abused her, criticized her appearance and once showed up to a meeting in his underwear.Melanie Sloan, a well-known Washington lawyer who for three years in the 1990s worked as Democratic counsel on the House Judiciary Committee, where Conyers remains the ranking Democrat, told the Detroit Free Press that Conyers constantly berated her, screaming at her and firing her and then rehiring her several times.She said he criticized her for not wearing stockings on at least one occasion. On another, she said he ordered her backstage from a committee field hearing on crime she had organized in New York City to babysit one of his children. Sloan made clear that she did not feel she had ever been sexually harassed, but that she felt  mistreated by this guy.",politics,"Nov 27, 2017",0
Two Turkish soldiers killed in northern Iraq: Turkish military,"ISTANBUL (Reuters) - Two Turkish soldiers were killed and one was wounded on Thursday in northern Iraq s Avasin Basyan region by Kurdistan Workers Party (PKK) militants, Turkey s military said. Separately, four militants were killed in the southeastern Turkish province of Tunceli, Dogan news agency said. A ceasefire between the Turkish state and PKK militants broke down in July 2015 and southeast Turkey subsequently saw some of the worst violence since the group launched its insurgency in 1984. More than 40,000 people, mostly Kurds, have been killed in the conflict. The PKK is designated a terrorist group by Turkey, the United States and the European Union.",worldnews,"November 16, 2017",1
JIMMY KIMMEL: Republicans ‘Should Be Praying for God to Forgive Them’ For Las Vegas Massacre,"Late-night TV host Jimmy Kimmel opened his program Monday with a ten-minute political rant about Sunday s mass murder in Las Vegas, saying  now is the time for political debate  about gun control.Dismissing as inadequate calls for prayers for the victims by President Donald Trump, House Speaker Paul Ryan, and Senate Majority Leader Mitch McConnell (R-KY), the Jimmy Kimmel Live host said:  they should be praying for God to forgive them for letting the gun lobby run this country. Kimmel railed against lawmakers who  won t do anything about this because the NRA has their balls in a money clip,  insisting that their  thoughts and your prayers are insufficient. The comic responded to those saying there was nothing that could have been done to stop Sunday s attack.  I disagree with that intensely,  Kimmel said,  because of course there s something we can do about it.   BreitbartMeanwhile, reports are coming out that Kimmel has increased his security detail  which consists of highly-trained, off-duty police officers.According to a report from The Blast on Monday, late night host Jimmy Kimmel has been bulking up on his security for his Jimmy Kimmel Live! show tapings, including the addition of  highly-trained, off-duty police officers  at both the front and back entrances. Per the report:Sources close to the show tell The Blast that ever since Kimmel re-ignited his campaign against the Republicans  health care proposals, the comedian has had some issues with protestors at the show.We re told the show has responded by adding security to the tapings   increasing personnel at both the front and back entrances.",left-news,"Oct 3, 2017",0
U.S. Senate conservatives propose tough restrictions on 'Dreamers',"WASHINGTON (Reuters) - Conservative Republicans in Congress on Monday unveiled their ideas for what should happen to so-called ‘Dreamer’ immigrants when an Obama-era program expires in March, touting tougher restrictions than those proposed by Democrats. The bill offered by Republican Senators Thom Tillis and James Lankford was in response to President Donald Trump’s move to end former President Barack Obama’s Deferred Action for Childhood Arrivals (DACA) program. Trump gave Congress six months to write replacement legislation. DACA temporarily shielded from deportation certain undocumented immigrants, known as ‘Dreamers,’ who were brought to the United States as children by family, many from Central America. The program allows work permits and other protections for around 800,000 people. The Tillis-Lankford measure would bar Dreamers from applying for citizenship for at least 15 years and would cover fewer people than a Democratic proposal. Trump has previously voiced support of a Democratic “Dream Act” bill, but wants to add new border security measures to it. Top Senate Democrat Chuck Schumer and top House of Representatives Democrat Nancy Pelosi have said that in a meeting with Trump they had discussed a path to citizenship for Dreamers after eight years. Lankford told reporters at a press conference that he recently had a long telephone conversation with Trump and briefed him on the legislation he and Tillis were crafting. Trump “was very supportive of the concepts, saying that is the right way to go,” said Lankford. Democrats are waiting for the White House to publish a list of ‘principles’ to guide Dreamer legislation. It was not clear whether those principles would be influenced by the Republicans’ bill. Senator Dick Durbin, the No. 2 Senate Democrat who has been pushing Dreamer legislation for 16 years, said the Republicans’ bill “falls short” because it “excludes tens of thousands of Dreamers” and would require those that do qualify to waive certain legal rights that could allow for deportations without due process. Nevertheless, there is bipartisan hope in Congress that differences can be ironed out now that Trump, who anchored his 2016 presidential campaign on an anti-immigration platform, says he wants to protect the Dreamers. “These are kids that literally do not have a home anywhere,” Lankford said. “They do not remember a home country they came from originally. They are not really considered (at) home here ... In American law we don’t hold children accountable for the actions of their parents.”",politicsNews,"September 25, 2017",1
UNREAL! HILLARY CLINTON Greeted By Sobbing Feminists After Event…Another Staged PR Stunt? [Video],"After the Reid event, Hillary Clinton greeted several Kaine staffers and young supporters, some of whom can be heard sobbing in this video pic.twitter.com/DRq0BApck1  Monica Alba (@albamonica) December 8, 2016",politics,"Dec 12, 2016",0
This Chart Captures Every Sexist Slur Trump Supporters Tweeted At Megyn Kelly (IMAGES),"On Tuesday, Trump announced that he would be skipping Thursday night s GOP debate because Fox News host Megyn Kelly would be moderating it, and Trump is scared sh*tless of her even since she made him look like a complete idiot the first time moderated the GOP debate.Since Trump got his ego handed to him on a silver platter, Trump has kept himself busy with a mostly one-sided feud against Kelly, solidifying the very sexist, misogynistic behavior the Fox host called him out on during the first debate. It should come as no surprise that Trump s supporters are just like him   disrespectful with unhealthy, hateful views toward women. And it couldn t be any more apparent than their activity on social media.VocativVocativThe tweets from Trump s supporters are hardly surprising   these are the same people who routinely attack protesters at Trump s rallies   animalistic, violent behavior which Trump sometimes even encourages.Because Trump has refused to participate in the debate, Trump s fans have been demanding that Kelly be removed from her position as moderator after Trump s initial demand for her exclusion was denied. Trump s followers are all sexist, misogynistic babies and it s easy to see why Trump appeals to these people.Featured image is a screenshot",News,"January 28, 2016",0
Jimmy Kimmel Is Pretty Sure He Knows Exactly Why Donald Trump Hasn’t Released His Taxes (VIDEO),"Many of us are still wondering where the hell Donald Trump s tax returns are. He keeps telling us that he can t release them because he s in the middle of an audit, but the IRS has already said that s not preventing him from releasing previous returns.Well, Jimmy Kimmel has a theory as to why Trump hasn t released his taxes   he s a lying liar.You see, Trump loves to go on and on and on and on and on about how much money he has, and how rich he is, and how yuuuuge his bank account is, but here s the thing, how the hell are we to know?Taking a beautifully sarcastic jab at Trump and his bragging was Jimmy Kimmel on his late night television show. He shows clip after clip of the reality television star repeatedly telling people how wealthy he is, including how he took a  small loan  of one million dollars from his father. Kimmel then says: What if the reason he won t release his tax returns is because he actually doesn t have any money. He s been goofing on us the whole time. Like he s Joe Millionaire and we re the stupid contestants. Wouldn t that be rich? Very valid theory. I guess we ll just have to wait and see since Trump is too scared to actually reveal whats going on with his finances.Watch the clip here:He doesn t like to talk about it, but @RealDonaldTrump has a lot of moneyhttps://t.co/3Nnu3XeUID  Jimmy Kimmel (@jimmykimmel) May 19, 2016Featured image via video screen captures",News,"May 19, 2016",0
